{
  "filename": "13bdb0b6-b59f-4a42-a58b-5a92cf9d058a.pdf",
  "timestamp": "2025-09-20T05:58:00.060Z",
  "processingTime": 1607,
  "confidence": 80,
  "extractedData": {
    "name": "Unknown",
    "email": "soni.sikkim21@gmail.com",
    "phone": "7979068204",
    "title": "CURRICULUM VITAE",
    "location": "st stage,Bangalore",
    "summary": "In search of a position which would help me to utilize my skills developed during my graduate studies and offer me excellent opportunity to develop my career. Summery: 1 Year of Experience in PHP, Laravel,Javascript, jQuery, MYSQL. Strong Development Experience in PHP, OOps concepts, MYSQL, HTML ,CodeIgniter Competent knowledge and skills in Object Oriented Design and Programming. Excellent analytical and logical programming skills with a good understanding at the conceptual level. Working Frien",
    "experience": [
      {
        "jobTitle": "CURRICULUM VITAE ( Immediate Joining) Name :- Soni kumari Address :- BTM 1st stage,Bangalore-560068 Contact No :- 7979068204, +91 8016836457 E-mail Address :- soni.sikkim21@gmail.com Career Objective: In search of a position which would help me to utilize my skills developed during my graduate studies and offer me excellent opportunity to develop my career. Summery: 1 Year of Experience in PHP, Laravel,Javascript, jQuery, MYSQL. Strong Development Experience in PHP, OOps concepts, MYSQL, HTML ,CodeIgniter Competent knowledge and skills in Object Oriented Design and Programming. Excellent analytical and logical programming skills with a good understanding at the conceptual level. Working Friendly with Git,. Ability to work in a dynamic environment . PROFESSIONAL EXPERIENCE: Title: Job portal ACADEMIC PROFILE: 2013-18 B.Tech Information Technology from Sikkim Manipal Institute of Technology, Sikkim (Gangtok) with 60% 2011-13 12th from Evening College,Saharsa (BSEB) With 68%. 2008-09 10th from St.joseph Pub School,Bihar (CBSE) With 63% Role : Laravel PHP Developer ,(1 year Experience) Environment : Php, MySql. Responsibilities : Developing application using Laravel PHP and MySql, Creation of custom web page for the content based website where the description of the customer relationship management (CRM) ,Expo Management and all details developed by me as developer under the guidance of one senior developer and designer. Functional and Unit Testing of the project as per the client requirement. Make reports. Skills: Programming Languages : Php ,Laravel Web Programming Skills : jQuery, HTML, CSS, PHP. CodeIgniter Database : MYSQL. Scripts : JavaScript,jQuery and Ajax Operating Systems : Windows7/8/8.1,Linux Projects:-  Worked as Laravel PHP developer and developed page for details of the clients listing and full details page of CRM (Customer Relationship Management) like FXOD, Money Expo and the functionality for Clients,lead,Deposits,Withdrawals of the clients with dynamic content and login for Members.  • Internship Project, HP Kolkata  Project based on‘Online Atm.  Training in Core Java conducted at HP Kolkata. Training:-  Completed (JAVA,J2EE,SQL,Hibernate,Spring & Web Technologies) Training from Jspiders BTM Bangalore. Achievements: 1. Got appreciation amount from dedicated client and many appreciation email and review. 2. Presented at well-known Project, Programming and applications conference . Personal Profile: Name : Soni Kumari Daughter of : Kedar Panjiyar Date of birth : 12 Jan 1994 Gender : Female Marital Status :Unmarried Nationality : Indian Hobbies : Singing,Web Surfing,Movies. Languages Known : English,Hindi Permanent Address : Dahlan Road, Saharsa,Bihar-852201 Declaration: I hereby declare that the above-mentioned information is correct up to my knowledge and I bear the responsibility for the correctness of the above-mentioned particulars. Place: (Signature)",
        "company": "Unknown",
        "duration": "Unknown",
        "techUsed": [],
        "description": "CURRICULUM VITAE ( Immediate Joining) Name :- Soni kumari Address :- BTM 1st stage,Bangalore-560068 Contact No :- 7979068204, +91 8016836457 E-mail Address :- soni.sikkim21@gmail.com Career Objective: In search of a position which would help me to utilize my skills developed during my graduate studies and offer me excellent opportunity to develop my career. Summery: 1 Year of Experience in PHP, Laravel,Javascript, jQuery, MYSQL. Strong Development Experience in PHP, OOps concepts, MYSQL, HTML ,CodeIgniter Competent knowledge and skills in Object Oriented Design and Programming. Excellent analytical and logical programming skills with a good understanding at the conceptual level. Working Friendly with Git,. Ability to work in a dynamic environment . PROFESSIONAL EXPERIENCE: Title: Job portal ACADEMIC PROFILE: 2013-18 B.Tech Information Technology from Sikkim Manipal Institute of Technology, Sikkim (Gangtok) with 60% 2011-13 12th from Evening College,Saharsa (BSEB) With 68%. 2008-09 10th from St.joseph Pub School,Bihar (CBSE) With 63% Role : Laravel PHP Developer ,(1 year Experience) Environment : Php, MySql. Responsibilities : Developing application using Laravel PHP and MySql, Creation of custom web page for the content based website where the description of the customer relationship management (CRM) ,Expo Management and all details developed by me as developer under the guidance of one senior developer and designer. Functional and Unit Testing of the project as per the client requirement. Make reports. Skills: Programming Languages : Php ,Laravel Web Programming Skills : jQuery, HTML, CSS, PHP. CodeIgniter Database : MYSQL. Scripts : JavaScript,jQuery and Ajax Operating Systems : Windows7/8/8.1,Linux Projects:-  Worked as Laravel PHP developer and developed page for details of the clients listing and full details page of CRM (Customer Relationship Management) like FXOD, Money Expo and the functionality for Clients,lead,Deposits,Withdrawals of the clients with dynamic content and login for Members.  • Internship Project, HP Kolkata  Project based on‘Online Atm.  Training in Core Java conducted at HP Kolkata. Training:-  Completed (JAVA,J2EE,SQL,Hibernate,Spring & Web Technologies) Training from Jspiders BTM Bangalore. Achievements: 1. Got appreciation amount from dedicated client and many appreciation email and review. 2. Presented at well-known Project, Programming and applications conference . Personal Profile: Name : Soni Kumari Daughter of : Kedar Panjiyar Date of birth : 12 Jan 1994 Gender : Female Marital Status :Unmarried Nationality : Indian Hobbies : Singing,Web Surfing,Movies. Languages Known : English,Hindi Permanent Address : Dahlan Road, Saharsa,Bihar-852201 Declaration: I hereby declare that the above-mentioned information is correct up to my knowledge and I bear the responsibility for the correctness of the above-mentioned particulars. Place: (Signature)"
      }
    ],
    "education": [
      {
        "degree": "CURRICULUM VITAE ( Immediate Joining) Name :- Soni kumari Address :- BTM 1st stage,Bangalore-560068 Contact No :- 7979068204, +91 8016836457 E-mail Address :- soni.sikkim21@gmail.com Career Objective: In search of a position which would help me to utilize my skills developed during my graduate studies and offer me excellent opportunity to develop my career. Summery: 1 Year of Experience in PHP, Laravel,Javascript, jQuery, MYSQL. Strong Development Experience in PHP, OOps concepts, MYSQL, HTML ,CodeIgniter Competent knowledge and skills in Object Oriented Design and Programming. Excellent analytical and logical programming skills with a good understanding at the conceptual level. Working Friendly with Git,. Ability to work in a dynamic environment . PROFESSIONAL EXPERIENCE: Title: Job portal ACADEMIC PROFILE: 2013-18 B.Tech Information Technology from Sikkim Manipal Institute of Technology, Sikkim (Gangtok) with 60% 2011-13 12th from Evening College,Saharsa (BSEB) With 68%. 2008-09 10th from St.joseph Pub School,Bihar (CBSE) With 63% Role : Laravel PHP Developer ,(1 year Experience) Environment : Php, MySql. Responsibilities : Developing application using Laravel PHP and MySql, Creation of custom web page for the content based website where the description of the customer relationship management (CRM) ,Expo Management and all details developed by me as developer under the guidance of one senior developer and designer. Functional and Unit Testing of the project as per the client requirement. Make reports. Skills: Programming Languages : Php ,Laravel Web Programming Skills : jQuery, HTML, CSS, PHP. CodeIgniter Database : MYSQL. Scripts : JavaScript,jQuery and Ajax Operating Systems : Windows7/8/8.1,Linux Projects:-  Worked as Laravel PHP developer and developed page for details of the clients listing and full details page of CRM (Customer Relationship Management) like FXOD, Money Expo and the functionality for Clients,lead,Deposits,Withdrawals of the clients with dynamic content and login for Members.  • Internship Project, HP Kolkata  Project based on‘Online Atm.  Training in Core Java conducted at HP Kolkata. Training:-  Completed (JAVA,J2EE,SQL,Hibernate,Spring & Web Technologies) Training from Jspiders BTM Bangalore. Achievements: 1. Got appreciation amount from dedicated client and many appreciation email and review. 2. Presented at well-known Project, Programming and applications conference . Personal Profile: Name : Soni Kumari Daughter of : Kedar Panjiyar Date of birth : 12 Jan 1994 Gender : Female Marital Status :Unmarried Nationality : Indian Hobbies : Singing,Web Surfing,Movies. Languages Known : English,Hindi Permanent Address : Dahlan Road, Saharsa,Bihar-852201 Declaration: I hereby declare that the above-mentioned information is correct up to my knowledge and I bear the responsibility for the correctness of the above-mentioned particulars. Place: (Signature)",
        "field": "Unknown",
        "university": "Unknown",
        "year": "Unknown"
      }
    ],
    "skills": [
      "JavaScript",
      "Java",
      "PHP",
      "HTML",
      "CSS",
      "Spring",
      "Laravel",
      "MySQL",
      "Git",
      "Linux",
      "Linux Projec"
    ],
    "projects": [
      {
        "name": "CURRICULUM VITAE ( Immediate Joining) Name :- Soni kumari Address :- BTM 1st stage,Bangalore-560068 Contact No :- 7979068204, +91 8016836457 E-mail Address :- soni.sikkim21@gmail.com Career Objective: In search of a position which would help me to utilize my skills developed during my graduate studies and offer me excellent opportunity to develop my career. Summery: 1 Year of Experience in PHP, Laravel,Javascript, jQuery, MYSQL. Strong Development Experience in PHP, OOps concepts, MYSQL, HTML ,CodeIgniter Competent knowledge and skills in Object Oriented Design and Programming. Excellent analytical and logical programming skills with a good understanding at the conceptual level. Working Friendly with Git,. Ability to work in a dynamic environment . PROFESSIONAL EXPERIENCE: Title: Job portal ACADEMIC PROFILE: 2013-18 B.Tech Information Technology from Sikkim Manipal Institute of Technology, Sikkim (Gangtok) with 60% 2011-13 12th from Evening College,Saharsa (BSEB) With 68%. 2008-09 10th from St.joseph Pub School,Bihar (CBSE) With 63% Role : Laravel PHP Developer ,(1 year Experience) Environment : Php, MySql. Responsibilities : Developing application using Laravel PHP and MySql, Creation of custom web page for the content based website where the description of the customer relationship management (CRM) ,Expo Management and all details developed by me as developer under the guidance of one senior developer and designer. Functional and Unit Testing of the project as per the client requirement. Make reports. Skills: Programming Languages : Php ,Laravel Web Programming Skills : jQuery, HTML, CSS, PHP. CodeIgniter Database : MYSQL. Scripts : JavaScript,jQuery and Ajax Operating Systems : Windows7/8/8.1,Linux Projects:-  Worked as Laravel PHP developer and developed page for details of the clients listing and full details page of CRM (Customer Relationship Management) like FXOD, Money Expo and the functionality for Clients,lead,Deposits,Withdrawals of the clients with dynamic content and login for Members.  • Internship Project, HP Kolkata  Project based on‘Online Atm.  Training in Core Java conducted at HP Kolkata. Training:-  Completed (JAVA,J2EE,SQL,Hibernate,Spring & Web Technologies) Training from Jspiders BTM Bangalore. Achievements: 1. Got appreciation amount from dedicated client and many appreciation email and review. 2. Presented at well-known Project, Programming and applications conference . Personal Profile: Name : Soni Kumari Daughter of : Kedar Panjiyar Date of birth : 12 Jan 1994 Gender : Female Marital Status :Unmarried Nationality : Indian Hobbies : Singing,Web Surfing,Movies. Languages Known : English,Hindi Permanent Address : Dahlan Road, Saharsa,Bihar-852201 Declaration: I hereby declare that the above-mentioned information is correct up to my knowledge and I bear the responsibility for the correctness of the above-mentioned particulars. Place: (Signature)",
        "description": "CURRICULUM VITAE ( Immediate Joining) Name :- Soni kumari Address :- BTM 1st stage,Bangalore-560068 Contact No :- 7979068204, +91 8016836457 E-mail Address :- soni.sikkim21@gmail.com Career Objective: In search of a position which would help me to utilize my skills developed during my graduate studies and offer me excellent opportunity to develop my career. Summery: 1 Year of Experience in PHP, Laravel,Javascript, jQuery, MYSQL. Strong Development Experience in PHP, OOps concepts, MYSQL, HTML ,CodeIgniter Competent knowledge and skills in Object Oriented Design and Programming. Excellent analytical and logical programming skills with a good understanding at the conceptual level. Working Friendly with Git,. Ability to work in a dynamic environment . PROFESSIONAL EXPERIENCE: Title: Job portal ACADEMIC PROFILE: 2013-18 B.Tech Information Technology from Sikkim Manipal Institute of Technology, Sikkim (Gangtok) with 60% 2011-13 12th from Evening College,Saharsa (BSEB) With 68%. 2008-09 10th from St.joseph Pub School,Bihar (CBSE) With 63% Role : Laravel PHP Developer ,(1 year Experience) Environment : Php, MySql. Responsibilities : Developing application using Laravel PHP and MySql, Creation of custom web page for the content based website where the description of the customer relationship management (CRM) ,Expo Management and all details developed by me as developer under the guidance of one senior developer and designer. Functional and Unit Testing of the project as per the client requirement. Make reports. Skills: Programming Languages : Php ,Laravel Web Programming Skills : jQuery, HTML, CSS, PHP. CodeIgniter Database : MYSQL. Scripts : JavaScript,jQuery and Ajax Operating Systems : Windows7/8/8.1,Linux Projects:-  Worked as Laravel PHP developer and developed page for details of the clients listing and full details page of CRM (Customer Relationship Management) like FXOD, Money Expo and the functionality for Clients,lead,Deposits,Withdrawals of the clients with dynamic content and login for Members.  • Internship Project, HP Kolkata  Project based on‘Online Atm.  Training in Core Java conducted at HP Kolkata. Training:-  Completed (JAVA,J2EE,SQL,Hibernate,Spring & Web Technologies) Training from Jspiders BTM Bangalore. Achievements: 1. Got appreciation amount from dedicated client and many appreciation email and review. 2. Presented at well-known Project, Programming and applications conference . Personal Profile: Name : Soni Kumari Daughter of : Kedar Panjiyar Date of birth : 12 Jan 1994 Gender : Female Marital Status :Unmarried Nationality : Indian Hobbies : Singing,Web Surfing,Movies. Languages Known : English,Hindi Permanent Address : Dahlan Road, Saharsa,Bihar-852201 Declaration: I hereby declare that the above-mentioned information is correct up to my knowledge and I bear the responsibility for the correctness of the above-mentioned particulars. Place: (Signature)",
        "techUsed": []
      }
    ],
    "certifications": []
  }
}