{
  "filename": "33fe3186-8eb9-4061-8488-d4a485c298ae.pdf",
  "timestamp": "2025-09-20T05:58:20.207Z",
  "processingTime": 1403,
  "confidence": 70,
  "extractedData": {
    "name": "Subhash Kumar",
    "email": "subhashka752woj4c_wya@indeedemail.com",
    "title": "Subhash Kumar A Kasaragod",
    "location": "Subhash Kumar A Kasaragod, Kerala subhashka",
    "experience": [
      {
        "jobTitle": "Subhash Kumar A Kasaragod, Kerala subhashka752woj4c_wya@indeedemail.com +91 70340 46701 To execute my innovative ideas in a challenging field for an organization. Willing to relocate: Anywhere Work Experience PHP Developer Integrated redcherry solution January 2022 to July 2022 • Six months internship with training at Integrated Redcherry Solutions Pvt Ltd as PHP Devleoper. Biodata: Name: Subhash Kumar A Date of Birth: 25-09-1995 Gender: Male Nationality: Indian Education Master's in Computer Science Kannur University - Kerala June 2016 to April 2018 Bachelor's in Computer Science Kannur University - Kerala June 2013 to May 2016 HSC in Science State board - Kerala June 2011 to March 2013 SSLC State Board 2011 Skills / IT Skills •Fundamentals of C and C++, Java, php, html. •PHP •MySQL •JavaScript •HTML5 •AJAX •CSS",
        "company": "Unknown",
        "duration": "Unknown",
        "techUsed": [],
        "description": "Subhash Kumar A Kasaragod, Kerala subhashka752woj4c_wya@indeedemail.com +91 70340 46701 To execute my innovative ideas in a challenging field for an organization. Willing to relocate: Anywhere Work Experience PHP Developer Integrated redcherry solution January 2022 to July 2022 • Six months internship with training at Integrated Redcherry Solutions Pvt Ltd as PHP Devleoper. Biodata: Name: Subhash Kumar A Date of Birth: 25-09-1995 Gender: Male Nationality: Indian Education Master's in Computer Science Kannur University - Kerala June 2016 to April 2018 Bachelor's in Computer Science Kannur University - Kerala June 2013 to May 2016 HSC in Science State board - Kerala June 2011 to March 2013 SSLC State Board 2011 Skills / IT Skills •Fundamentals of C and C++, Java, php, html. •PHP •MySQL •JavaScript •HTML5 •AJAX •CSS"
      }
    ],
    "education": [
      {
        "degree": "Subhash Kumar A Kasaragod, Kerala subhashka752woj4c_wya@indeedemail.com +91 70340 46701 To execute my innovative ideas in a challenging field for an organization. Willing to relocate: Anywhere Work Experience PHP Developer Integrated redcherry solution January 2022 to July 2022 • Six months internship with training at Integrated Redcherry Solutions Pvt Ltd as PHP Devleoper. Biodata: Name: Subhash Kumar A Date of Birth: 25-09-1995 Gender: Male Nationality: Indian Education Master's in Computer Science Kannur University - Kerala June 2016 to April 2018 Bachelor's in Computer Science Kannur University - Kerala June 2013 to May 2016 HSC in Science State board - Kerala June 2011 to March 2013 SSLC State Board 2011 Skills / IT Skills •Fundamentals of C and C++, Java, php, html. •PHP •MySQL •JavaScript •HTML5 •AJAX •CSS",
        "field": "Unknown",
        "university": "Unknown",
        "year": "Unknown"
      }
    ],
    "skills": [
      "JavaScript",
      "Java",
      "PHP",
      "HTML",
      "CSS",
      "MySQL"
    ],
    "projects": [],
    "certifications": []
  }
}