{
  "filename": "bbb7b7cf-0b2a-492a-899c-2bb44a337f8f.pdf",
  "timestamp": "2025-10-14T09:04:26.050Z",
  "processingTime": 1790,
  "confidence": 82,
  "extractedData": {
    "name": "Unknown",
    "email": "ramki028@gmail.com",
    "phone": "8072205100",
    "title": "RAMKUMAR B Virudhunagar",
    "location": "RAMKUMAR B Virudhunagar, India",
    "summary": "Dynamic software developer with over 5 Years 8 Months of proven expertise in web application development. Eagerly pursuing opportunities to leverage my skills for the benefit of your esteemed company while continuously improving my skills in a collaborative and fast-paced environment. SKILLS Programming Languages : PHP, JavaScript, TypeScript Frameworks & Libraries : React, CodeIgniter, Laravel, jQuery, Bootstrap 4 & 5, React Native, Tailwind CSS Databases : MySQL, SQLite Miscellaneous : Git, Li",
    "experience": [
      {
        "jobTitle": "RAMKUMAR B Virudhunagar, India 626004 ramki028@gmail.com / 8072205100 WWW: https://www.linkedin.com/in/ramkumar-b-560961177/ SUMMARY Dynamic software developer with over 5 Years 8 Months of proven expertise in web application development. Eagerly pursuing opportunities to leverage my skills for the benefit of your esteemed company while continuously improving my skills in a collaborative and fast-paced environment. SKILLS Programming Languages : PHP, JavaScript, TypeScript Frameworks & Libraries : React, CodeIgniter, Laravel, jQuery, Bootstrap 4 & 5, React Native, Tailwind CSS Databases : MySQL, SQLite Miscellaneous : Git, Linux, Server Handling EXPERIENCE 10/2024 - CurrentSoftware Engineer / iOPEX Technologies - Chennai IQMS – Internal Quality Management System Developed a project management tool to help non-technical stakeholders track quality and process initiatives across departments. Key features: task assignment, milestone tracking, user access, and status dashboards. Food Coupon Management System Built a centralized system for automating food coupon generation, QR-based verification at counters, and integration with attendance to prevent misuse. CDR – Candidate Data Repository Revamped a candidate management portal with AI-driven automation, migrating from PHP to React Redux. Improved the seven-stage form with intelligent autofill, optimizing registration, document handling, and interview scheduling for an efficient HR workflow. Other Projects Contributed to various internal applications at iOPEX Technologies, focusing on process automation, data management, and user experience enhancements. 03/2021 - 10/2024Senior Software Engineer / Nirals Information Technologies - Kovilpatti Eduniv – Comprehensive School and College Management System Led the enhancement of an ERP system used by 250+ institutions to digitalize academic and admin processes. Key features included: Online admission, fee management, and automated payroll. GPS transport tracking and RFID-based attendance logging. Mobile apps for staff and students (Android/iOS) for easy access. New modules for ID card generation, homework tracking, hostel management, and more. Optimized Linux-based server operations and integrated with third-party systems. Mentored junior developers and improved team collaboration. Served 1M+ users, boosting institutional efficiency. Vahupu – Comprehensive Virtual Learning Platform Developed an e-learning platform to ensure education continuity during the COVID-19 pandemic. Key features included: Virtual classroom management, online classes, live events, and scheduling tools. RB Modules for subject, staff, and course management, plus an examination system. Support for digital content (blogs, podcasts, worksheets) and skill development. Custom solutions for NEET, JEE, and competitive exam prep. Role-based access, responsive UI, and web/mobile integration. Enabled seamless learning experiences during lockdowns, helping schools and institutions maintain continuity. eezo – Human Resource Management & Job Portal Developed a job portal aimed at simplifying recruitment for both candidates and employers. Key features included: AI-driven job matching for better candidate-job alignment. Easy job application process for users and recruiters. Personalized profiles for job seekers with skills and preferences. Real-time notifications for job updates and interview schedules. Employer dashboard to manage job postings and view applications. The platform helped speed up the hiring process and improved recruitment efficiency. 02/2019 - 05/2020Software Engineer / Concent Solutions Private Limited - Hyderabad Healpha – Healthcare Platform Product Contributed to a full-scale healthcare platform that streamlined digital medical services and mobile health tracking. Key responsibilities and achievements include: Developed RESTful APIs for mobile application integration, enabling secure communication with patient and doctor interfaces. Built core modules including a BP checker and child health monitoring system to support accurate and user-friendly health data tracking. Designed responsive mobile interfaces for doctors and patients, improving user experience and streamlining appointment scheduling. Helped deploy services for large-scale initiatives, including school health programs across Telangana and Tamil Nadu, and for Haj Yatra travelers. Improved medical record accessibility, reducing manual intervention and supporting more efficient healthcare delivery. 02/2019 - 06/2019Trainee Software Engineer / Concent Solutions Private Limited - Hyderabad Training Phase – Web and Mobile Development Participated in a structured training program and contributed to real-time projects under supervision. Key highlights include: Assisted in developing web applications using PHP, HTML, CSS, and JavaScript. Worked closely with senior developers to understand industry best practices, debugging techniques, and project workflows. Contributed to the initial stages of mobile application development using React Native, gaining experience in cross-platform UI design and component structure. EDUCATION 04/2019Bachelor of Engineering: Computer Science Sri Vidya College of Engineering & Technology - Virudhunagar GPA: 7.2 LANGUAGES Tamil: First Language English: Professional Proficiency (C1 Level)",
        "company": "Unknown",
        "duration": "Unknown",
        "techUsed": [],
        "description": "RAMKUMAR B Virudhunagar, India 626004 ramki028@gmail.com / 8072205100 WWW: https://www.linkedin.com/in/ramkumar-b-560961177/ SUMMARY Dynamic software developer with over 5 Years 8 Months of proven expertise in web application development. Eagerly pursuing opportunities to leverage my skills for the benefit of your esteemed company while continuously improving my skills in a collaborative and fast-paced environment. SKILLS Programming Languages : PHP, JavaScript, TypeScript Frameworks & Libraries : React, CodeIgniter, Laravel, jQuery, Bootstrap 4 & 5, React Native, Tailwind CSS Databases : MySQL, SQLite Miscellaneous : Git, Linux, Server Handling EXPERIENCE 10/2024 - CurrentSoftware Engineer / iOPEX Technologies - Chennai IQMS – Internal Quality Management System Developed a project management tool to help non-technical stakeholders track quality and process initiatives across departments. Key features: task assignment, milestone tracking, user access, and status dashboards. Food Coupon Management System Built a centralized system for automating food coupon generation, QR-based verification at counters, and integration with attendance to prevent misuse. CDR – Candidate Data Repository Revamped a candidate management portal with AI-driven automation, migrating from PHP to React Redux. Improved the seven-stage form with intelligent autofill, optimizing registration, document handling, and interview scheduling for an efficient HR workflow. Other Projects Contributed to various internal applications at iOPEX Technologies, focusing on process automation, data management, and user experience enhancements. 03/2021 - 10/2024Senior Software Engineer / Nirals Information Technologies - Kovilpatti Eduniv – Comprehensive School and College Management System Led the enhancement of an ERP system used by 250+ institutions to digitalize academic and admin processes. Key features included: Online admission, fee management, and automated payroll. GPS transport tracking and RFID-based attendance logging. Mobile apps for staff and students (Android/iOS) for easy access. New modules for ID card generation, homework tracking, hostel management, and more. Optimized Linux-based server operations and integrated with third-party systems. Mentored junior developers and improved team collaboration. Served 1M+ users, boosting institutional efficiency. Vahupu – Comprehensive Virtual Learning Platform Developed an e-learning platform to ensure education continuity during the COVID-19 pandemic. Key features included: Virtual classroom management, online classes, live events, and scheduling tools. RB Modules for subject, staff, and course management, plus an examination system. Support for digital content (blogs, podcasts, worksheets) and skill development. Custom solutions for NEET, JEE, and competitive exam prep. Role-based access, responsive UI, and web/mobile integration. Enabled seamless learning experiences during lockdowns, helping schools and institutions maintain continuity. eezo – Human Resource Management & Job Portal Developed a job portal aimed at simplifying recruitment for both candidates and employers. Key features included: AI-driven job matching for better candidate-job alignment. Easy job application process for users and recruiters. Personalized profiles for job seekers with skills and preferences. Real-time notifications for job updates and interview schedules. Employer dashboard to manage job postings and view applications. The platform helped speed up the hiring process and improved recruitment efficiency. 02/2019 - 05/2020Software Engineer / Concent Solutions Private Limited - Hyderabad Healpha – Healthcare Platform Product Contributed to a full-scale healthcare platform that streamlined digital medical services and mobile health tracking. Key responsibilities and achievements include: Developed RESTful APIs for mobile application integration, enabling secure communication with patient and doctor interfaces. Built core modules including a BP checker and child health monitoring system to support accurate and user-friendly health data tracking. Designed responsive mobile interfaces for doctors and patients, improving user experience and streamlining appointment scheduling. Helped deploy services for large-scale initiatives, including school health programs across Telangana and Tamil Nadu, and for Haj Yatra travelers. Improved medical record accessibility, reducing manual intervention and supporting more efficient healthcare delivery. 02/2019 - 06/2019Trainee Software Engineer / Concent Solutions Private Limited - Hyderabad Training Phase – Web and Mobile Development Participated in a structured training program and contributed to real-time projects under supervision. Key highlights include: Assisted in developing web applications using PHP, HTML, CSS, and JavaScript. Worked closely with senior developers to understand industry best practices, debugging techniques, and project workflows. Contributed to the initial stages of mobile application development using React Native, gaining experience in cross-platform UI design and component structure. EDUCATION 04/2019Bachelor of Engineering: Computer Science Sri Vidya College of Engineering & Technology - Virudhunagar GPA: 7.2 LANGUAGES Tamil: First Language English: Professional Proficiency (C1 Level)"
      }
    ],
    "education": [
      {
        "degree": "RAMKUMAR B Virudhunagar, India 626004 ramki028@gmail.com / 8072205100 WWW: https://www.linkedin.com/in/ramkumar-b-560961177/ SUMMARY Dynamic software developer with over 5 Years 8 Months of proven expertise in web application development. Eagerly pursuing opportunities to leverage my skills for the benefit of your esteemed company while continuously improving my skills in a collaborative and fast-paced environment. SKILLS Programming Languages : PHP, JavaScript, TypeScript Frameworks & Libraries : React, CodeIgniter, Laravel, jQuery, Bootstrap 4 & 5, React Native, Tailwind CSS Databases : MySQL, SQLite Miscellaneous : Git, Linux, Server Handling EXPERIENCE 10/2024 - CurrentSoftware Engineer / iOPEX Technologies - Chennai IQMS – Internal Quality Management System Developed a project management tool to help non-technical stakeholders track quality and process initiatives across departments. Key features: task assignment, milestone tracking, user access, and status dashboards. Food Coupon Management System Built a centralized system for automating food coupon generation, QR-based verification at counters, and integration with attendance to prevent misuse. CDR – Candidate Data Repository Revamped a candidate management portal with AI-driven automation, migrating from PHP to React Redux. Improved the seven-stage form with intelligent autofill, optimizing registration, document handling, and interview scheduling for an efficient HR workflow. Other Projects Contributed to various internal applications at iOPEX Technologies, focusing on process automation, data management, and user experience enhancements. 03/2021 - 10/2024Senior Software Engineer / Nirals Information Technologies - Kovilpatti Eduniv – Comprehensive School and College Management System Led the enhancement of an ERP system used by 250+ institutions to digitalize academic and admin processes. Key features included: Online admission, fee management, and automated payroll. GPS transport tracking and RFID-based attendance logging. Mobile apps for staff and students (Android/iOS) for easy access. New modules for ID card generation, homework tracking, hostel management, and more. Optimized Linux-based server operations and integrated with third-party systems. Mentored junior developers and improved team collaboration. Served 1M+ users, boosting institutional efficiency. Vahupu – Comprehensive Virtual Learning Platform Developed an e-learning platform to ensure education continuity during the COVID-19 pandemic. Key features included: Virtual classroom management, online classes, live events, and scheduling tools. RB Modules for subject, staff, and course management, plus an examination system. Support for digital content (blogs, podcasts, worksheets) and skill development. Custom solutions for NEET, JEE, and competitive exam prep. Role-based access, responsive UI, and web/mobile integration. Enabled seamless learning experiences during lockdowns, helping schools and institutions maintain continuity. eezo – Human Resource Management & Job Portal Developed a job portal aimed at simplifying recruitment for both candidates and employers. Key features included: AI-driven job matching for better candidate-job alignment. Easy job application process for users and recruiters. Personalized profiles for job seekers with skills and preferences. Real-time notifications for job updates and interview schedules. Employer dashboard to manage job postings and view applications. The platform helped speed up the hiring process and improved recruitment efficiency. 02/2019 - 05/2020Software Engineer / Concent Solutions Private Limited - Hyderabad Healpha – Healthcare Platform Product Contributed to a full-scale healthcare platform that streamlined digital medical services and mobile health tracking. Key responsibilities and achievements include: Developed RESTful APIs for mobile application integration, enabling secure communication with patient and doctor interfaces. Built core modules including a BP checker and child health monitoring system to support accurate and user-friendly health data tracking. Designed responsive mobile interfaces for doctors and patients, improving user experience and streamlining appointment scheduling. Helped deploy services for large-scale initiatives, including school health programs across Telangana and Tamil Nadu, and for Haj Yatra travelers. Improved medical record accessibility, reducing manual intervention and supporting more efficient healthcare delivery. 02/2019 - 06/2019Trainee Software Engineer / Concent Solutions Private Limited - Hyderabad Training Phase – Web and Mobile Development Participated in a structured training program and contributed to real-time projects under supervision. Key highlights include: Assisted in developing web applications using PHP, HTML, CSS, and JavaScript. Worked closely with senior developers to understand industry best practices, debugging techniques, and project workflows. Contributed to the initial stages of mobile application development using React Native, gaining experience in cross-platform UI design and component structure. EDUCATION 04/2019Bachelor of Engineering: Computer Science Sri Vidya College of Engineering & Technology - Virudhunagar GPA: 7.2 LANGUAGES Tamil: First Language English: Professional Proficiency (C1 Level)",
        "field": "Unknown",
        "university": "Unknown",
        "year": "Unknown"
      }
    ],
    "skills": [
      "JavaScript",
      "TypeScript",
      "PHP",
      "React",
      "HTML",
      "CSS",
      "Bootstrap",
      "Tailwind",
      "Laravel",
      "MySQL",
      "SQLite",
      "Git",
      "Linux"
    ],
    "projects": [
      {
        "name": "RAMKUMAR B Virudhunagar, India 626004 ramki028@gmail.com / 8072205100 WWW: https://www.linkedin.com/in/ramkumar-b-560961177/ SUMMARY Dynamic software developer with over 5 Years 8 Months of proven expertise in web application development. Eagerly pursuing opportunities to leverage my skills for the benefit of your esteemed company while continuously improving my skills in a collaborative and fast-paced environment. SKILLS Programming Languages : PHP, JavaScript, TypeScript Frameworks & Libraries : React, CodeIgniter, Laravel, jQuery, Bootstrap 4 & 5, React Native, Tailwind CSS Databases : MySQL, SQLite Miscellaneous : Git, Linux, Server Handling EXPERIENCE 10/2024 - CurrentSoftware Engineer / iOPEX Technologies - Chennai IQMS – Internal Quality Management System Developed a project management tool to help non-technical stakeholders track quality and process initiatives across departments. Key features: task assignment, milestone tracking, user access, and status dashboards. Food Coupon Management System Built a centralized system for automating food coupon generation, QR-based verification at counters, and integration with attendance to prevent misuse. CDR – Candidate Data Repository Revamped a candidate management portal with AI-driven automation, migrating from PHP to React Redux. Improved the seven-stage form with intelligent autofill, optimizing registration, document handling, and interview scheduling for an efficient HR workflow. Other Projects Contributed to various internal applications at iOPEX Technologies, focusing on process automation, data management, and user experience enhancements. 03/2021 - 10/2024Senior Software Engineer / Nirals Information Technologies - Kovilpatti Eduniv – Comprehensive School and College Management System Led the enhancement of an ERP system used by 250+ institutions to digitalize academic and admin processes. Key features included: Online admission, fee management, and automated payroll. GPS transport tracking and RFID-based attendance logging. Mobile apps for staff and students (Android/iOS) for easy access. New modules for ID card generation, homework tracking, hostel management, and more. Optimized Linux-based server operations and integrated with third-party systems. Mentored junior developers and improved team collaboration. Served 1M+ users, boosting institutional efficiency. Vahupu – Comprehensive Virtual Learning Platform Developed an e-learning platform to ensure education continuity during the COVID-19 pandemic. Key features included: Virtual classroom management, online classes, live events, and scheduling tools. RB Modules for subject, staff, and course management, plus an examination system. Support for digital content (blogs, podcasts, worksheets) and skill development. Custom solutions for NEET, JEE, and competitive exam prep. Role-based access, responsive UI, and web/mobile integration. Enabled seamless learning experiences during lockdowns, helping schools and institutions maintain continuity. eezo – Human Resource Management & Job Portal Developed a job portal aimed at simplifying recruitment for both candidates and employers. Key features included: AI-driven job matching for better candidate-job alignment. Easy job application process for users and recruiters. Personalized profiles for job seekers with skills and preferences. Real-time notifications for job updates and interview schedules. Employer dashboard to manage job postings and view applications. The platform helped speed up the hiring process and improved recruitment efficiency. 02/2019 - 05/2020Software Engineer / Concent Solutions Private Limited - Hyderabad Healpha – Healthcare Platform Product Contributed to a full-scale healthcare platform that streamlined digital medical services and mobile health tracking. Key responsibilities and achievements include: Developed RESTful APIs for mobile application integration, enabling secure communication with patient and doctor interfaces. Built core modules including a BP checker and child health monitoring system to support accurate and user-friendly health data tracking. Designed responsive mobile interfaces for doctors and patients, improving user experience and streamlining appointment scheduling. Helped deploy services for large-scale initiatives, including school health programs across Telangana and Tamil Nadu, and for Haj Yatra travelers. Improved medical record accessibility, reducing manual intervention and supporting more efficient healthcare delivery. 02/2019 - 06/2019Trainee Software Engineer / Concent Solutions Private Limited - Hyderabad Training Phase – Web and Mobile Development Participated in a structured training program and contributed to real-time projects under supervision. Key highlights include: Assisted in developing web applications using PHP, HTML, CSS, and JavaScript. Worked closely with senior developers to understand industry best practices, debugging techniques, and project workflows. Contributed to the initial stages of mobile application development using React Native, gaining experience in cross-platform UI design and component structure. EDUCATION 04/2019Bachelor of Engineering: Computer Science Sri Vidya College of Engineering & Technology - Virudhunagar GPA: 7.2 LANGUAGES Tamil: First Language English: Professional Proficiency (C1 Level)",
        "description": "RAMKUMAR B Virudhunagar, India 626004 ramki028@gmail.com / 8072205100 WWW: https://www.linkedin.com/in/ramkumar-b-560961177/ SUMMARY Dynamic software developer with over 5 Years 8 Months of proven expertise in web application development. Eagerly pursuing opportunities to leverage my skills for the benefit of your esteemed company while continuously improving my skills in a collaborative and fast-paced environment. SKILLS Programming Languages : PHP, JavaScript, TypeScript Frameworks & Libraries : React, CodeIgniter, Laravel, jQuery, Bootstrap 4 & 5, React Native, Tailwind CSS Databases : MySQL, SQLite Miscellaneous : Git, Linux, Server Handling EXPERIENCE 10/2024 - CurrentSoftware Engineer / iOPEX Technologies - Chennai IQMS – Internal Quality Management System Developed a project management tool to help non-technical stakeholders track quality and process initiatives across departments. Key features: task assignment, milestone tracking, user access, and status dashboards. Food Coupon Management System Built a centralized system for automating food coupon generation, QR-based verification at counters, and integration with attendance to prevent misuse. CDR – Candidate Data Repository Revamped a candidate management portal with AI-driven automation, migrating from PHP to React Redux. Improved the seven-stage form with intelligent autofill, optimizing registration, document handling, and interview scheduling for an efficient HR workflow. Other Projects Contributed to various internal applications at iOPEX Technologies, focusing on process automation, data management, and user experience enhancements. 03/2021 - 10/2024Senior Software Engineer / Nirals Information Technologies - Kovilpatti Eduniv – Comprehensive School and College Management System Led the enhancement of an ERP system used by 250+ institutions to digitalize academic and admin processes. Key features included: Online admission, fee management, and automated payroll. GPS transport tracking and RFID-based attendance logging. Mobile apps for staff and students (Android/iOS) for easy access. New modules for ID card generation, homework tracking, hostel management, and more. Optimized Linux-based server operations and integrated with third-party systems. Mentored junior developers and improved team collaboration. Served 1M+ users, boosting institutional efficiency. Vahupu – Comprehensive Virtual Learning Platform Developed an e-learning platform to ensure education continuity during the COVID-19 pandemic. Key features included: Virtual classroom management, online classes, live events, and scheduling tools. RB Modules for subject, staff, and course management, plus an examination system. Support for digital content (blogs, podcasts, worksheets) and skill development. Custom solutions for NEET, JEE, and competitive exam prep. Role-based access, responsive UI, and web/mobile integration. Enabled seamless learning experiences during lockdowns, helping schools and institutions maintain continuity. eezo – Human Resource Management & Job Portal Developed a job portal aimed at simplifying recruitment for both candidates and employers. Key features included: AI-driven job matching for better candidate-job alignment. Easy job application process for users and recruiters. Personalized profiles for job seekers with skills and preferences. Real-time notifications for job updates and interview schedules. Employer dashboard to manage job postings and view applications. The platform helped speed up the hiring process and improved recruitment efficiency. 02/2019 - 05/2020Software Engineer / Concent Solutions Private Limited - Hyderabad Healpha – Healthcare Platform Product Contributed to a full-scale healthcare platform that streamlined digital medical services and mobile health tracking. Key responsibilities and achievements include: Developed RESTful APIs for mobile application integration, enabling secure communication with patient and doctor interfaces. Built core modules including a BP checker and child health monitoring system to support accurate and user-friendly health data tracking. Designed responsive mobile interfaces for doctors and patients, improving user experience and streamlining appointment scheduling. Helped deploy services for large-scale initiatives, including school health programs across Telangana and Tamil Nadu, and for Haj Yatra travelers. Improved medical record accessibility, reducing manual intervention and supporting more efficient healthcare delivery. 02/2019 - 06/2019Trainee Software Engineer / Concent Solutions Private Limited - Hyderabad Training Phase – Web and Mobile Development Participated in a structured training program and contributed to real-time projects under supervision. Key highlights include: Assisted in developing web applications using PHP, HTML, CSS, and JavaScript. Worked closely with senior developers to understand industry best practices, debugging techniques, and project workflows. Contributed to the initial stages of mobile application development using React Native, gaining experience in cross-platform UI design and component structure. EDUCATION 04/2019Bachelor of Engineering: Computer Science Sri Vidya College of Engineering & Technology - Virudhunagar GPA: 7.2 LANGUAGES Tamil: First Language English: Professional Proficiency (C1 Level)",
        "techUsed": []
      }
    ],
    "certifications": []
  }
}